{
  "schema_version": "fobrain.tool_result.v2",
  "tool_id": "tool.fobrain.get_vulnerability_detail",
  "display_type": "entity_detail",
  "entity_type": "vulnerability",
  "status": "resolved",
  "query": {},
  "data": {
    "title": "查询漏洞详情",
    "summary": "查询漏洞详情 fixture",
    "facts": [
      {
        "key": "display_name",
        "label": "名称",
        "value": "查询漏洞详情 示例",
        "type": "text"
      },
      {
        "key": "status",
        "label": "状态",
        "value": "resolved",
        "type": "status"
      }
    ]
  },
  "metadata": {
    "safe": true,
    "source": "fobrain",
    "result_ref": "result:fobrain:tool.fobrain.get-vulnerability-detail:fixture"
  }
}
