{
  "schema_version": "fobrain.tool_result.v2",
  "tool_id": "tool.fobrain.current_user_context",
  "display_type": "entity_detail",
  "entity_type": "user",
  "status": "resolved",
  "query": {},
  "data": {
    "title": "读取当前用户信息",
    "summary": "读取当前用户信息 fixture",
    "facts": [
      {
        "key": "display_name",
        "label": "名称",
        "value": "读取当前用户信息 示例",
        "type": "text"
      },
      {
        "key": "status",
        "label": "状态",
        "value": "resolved",
        "type": "status"
      }
    ]
  },
  "metadata": {
    "safe": true,
    "source": "fobrain",
    "result_ref": "result:fobrain:tool.fobrain.current-user-context:fixture"
  }
}
